"","date_utc","timestamp","title","text","subreddit","comments","url"
"I made a fantasy race recently for an unnamed world I'm making.8","2023-03-10",1678415138,"I made  fantasy race recently   unnamed world Im makng","They  called ashborn I    knd  pctures   I   s  etremely long pece  tet eplanng m The world doesnt   name    typcal fantasy deas lke many gods nonhuman races  world tree  lot  magc etc I    parts   world eplaned lke ths yet  I fgured Id show  I    put t   crtcsm Sorry   long t s

Ashborn Physcal Trats Ther body shape s    average human wth   varatons  occur n humans   heght  weght They   however possess  knd  seual organs snce    made  nstruments  war see ashborn hstory Ther skn depends   ashes   born  see Ashborn concepton  vares  black  whte wth many greys n  Ther skn may also  cracks  fre n  dependng  freshness  ashes see Ashborn concepton Ashborn eyes  qute dfferent   races wth  whtes  r eyes beng black  r pupls  rses beng   color across  members   race beng     secton   eye s made    ragng fre Ther har  eyebrows  also made  fre  tend  flow wth  wnd n   way  regular fre Ther har grows    normal har  can   cut wth  precse handlng  water  waterrelated blades The fre  makes  r har s always pleasantly warm  f eperencng ntense emotons especally anger r har can burn much hotter   pont  meltng metal Lastly  ashborn  etremely weak  water wth  much eposure beng able  kll  ashborn


Ashborn Concepton Ashborns   r name mples born  ashes Apart   frst famly  ashborns see ashborn hstory every ashborn s created  anor  large ples  ashes The color  freshness  ashes   large mpact   appearance   ashborn created The color  ashes changes  skn color   ashborn created  freshness can add new detals  r skn One eample  ths s  f  ashes  stll smolderng n  new ashborns skn wll also  smolderng although ths  one day go away f  ashborn s suffcently cooled


Ashborn Lfespan When ashborns  made   usually made  small chldren lookng much lke  normal human chld That also means   skp  baby stage  lfe although  physcally meanng  stll   knowledge  ablty   newborn Ashborns can lve  long   receve bursts  etreme heat every  years often accomplshed  jumpng nto  volcano see ashborn socety  can also  done n  ways   magcal fre   long perod  tme spent n  regular fre So long   receve ths heat  can lve forever


Ashborn Hstory Ashborn   ancent race  date back   years n whch    world  veled n war Ths led  unprecedented death   meant  people   fnd easer ways  dspose  corpses Ther natural response   burn  corpses n large ples untl   nothng  ash Ths angered  pacfst god  fre known  Emr snce  ddnt want  creaton   blessed upon  world   used   purposes Ths led  hm rasng  army  ashborn   ash ples  across  world orderng m  attack  warrng races ndscrmnately untl  ceased r sacrlegous acts The ashborn followed orders     years  forced  people  stop burnng r corpses n   way  began  queston r purpose They receved   gudance  Emr   attempted  assmlate nto  rest  socety However   many attacks   people faced   ashborn people refused r assmlaton  shunned m  places gong  far    mages wth water magc   ready  kll  ashborn  sght Ashborn around  world prayed  Emr daly   years  prayng  persecuton Emr fnally asssted  Ashborn  creatng large sectons  volcanc land  cooperatng wth Ruana  goddess  earth Ashborn around  world flooded   lands makng m r   formng r  socetes based   ones  saw n   races For decades   ashborn lved r lves away   rest   world   pont    becomng nothng   scary stores  tell r chldren However accordng  legend   changed wth  noble ashborn warror known  Segmre  Tempest Segmre supposedly went   journey around  world  kll  malevolent god On ths journey  s sad   helped break stereotypes n hs race along wth hs sster  devlknd  orc   dusk elf Ths led   ashborn takng anor shot  jonng  rest  socety  though  response  etremely negatve  frst  ashborn  now far  normalzed n socety   people  even ntegrated nto ashborn socety


Ashborn Socety Because  ashborn came nto ths world wth  pror knowledge    dea   functonng socety    knowledge  got  attackng ctes  mnmal Thus   ashborn  gven homes    unorganzed havng  real leader  nstead just havng many unspoken rules  vared based    town  facng Ths much lke  ashborns publ mage changed wth Segmre  Tempest Wth hs help breakng   stereotypes surroundng  ashborn   able  learn    socety   races  adopt   r customs  r  The man addton  r socety   addton  government somethng   barebones   best   warrors actons The adopton  government  nconsstent   ashborn snce   found   contnents       glean  nfo   socetes  found around m The  prevalent government   smple town councl  every ctzen  vote  propose new laws Because    ths r socety flourshed    able  ft n wth   cultures around  world


Ashborn Names Ashborn tend   names related  somethng  someone  r parents eperenced  met  r journeys Names based  places  thngs n journeys  usually genderless   namng  chld Dragon  Forest Names based  people wll  used   gender   person    Alca  Aleander Some ashborn  known  change r name f  fnd somethng  r journey  truly astounds m although  older ashborn see ths   henous breach n tradton Ashborn last names   rare occurrence usually  occurrng   parents somehow got nto noblty   parents couldnt decde  two names


Ashborn Culture The ashborn    much  r  culture   parts      mportant  m  anythng Ashborn relgon s manly focused  worshpng Emr wth  smaller facton worshpng Ruana  well Some ashborn also adopted  relgons   cultures   people    far  due   major debt   ashborn owe  Emr  Ruana In terms  ashborn marrage t s  ceremony n whch  two ashborn n queston take  plunge nto  volcano toger forweek durng whch  two ashborn wll spend every moment toger n harmony bondng mselves   long    shall lve After  two leave  volcano  usually make r  chld    ashes around  volcano although  ashborn choose   f  dont feel ready The act  makng  chld s   ntmate act  two ashborn can engage n  t s seen  taboo  anyone else  watch ths ceremony After   marred ashborn wll often go  long journeys around  world wth r spouse  chldren  years  endng  r chld s old enough  fght After ths  famly wll settle  somewhere  fnsh rasng r chldren Once  chldren  deemed old enough  r parents  wll set  nto  world  fnd r  purpose   cycle eventually repeats agan


Ashborn Of Note The  well known ashborn s  noble warror Segmre  Tempest  ashborn swordsman   cursed   god  twlght whose name remans unknown Segmre went  hs journey wth hs sster Avelna  many ors He earned hs ttle   tempest  hs journey due  hs sgnature flamberge longsword enchanted wth lghtnng On hs journey  slayed  dragon toppled  despcable kng  klled  god  cursed hm After ths hs  party vanshed fadng nto legend However many people assume   warror  forced  take  place   god  lve  untl anor grows tred  hm Segmres sster Avelna  also  famous warror She   noble archer  f stealng  every  f  returnng  goods  r rghtful owners Avelna also went   journey wth Segmre  kll  god  twlght     great help f  beleve legend Much lke  rest   party  also vanshed However recently re   talks   feryhared f    gong around stealng     vle carryng  bow   famlar flamberge sword The fnal ashborn  note s Greysen Ironsde  member   orgnal ashborn army created  Emr   years ago Greysen  one  f   strongest warror n   ashborn army leadng m  trumph n  battle  fought n He   charsmatc man    army admred  hs skll wth  ae  unrvaled n hs tme Unfortunately  met hs end durng  fnal battle  fought n tryng  save  defenseless group  ashborn  death However legend says   s stll n  afterlfe today   whenever  hear  thunder n  sky  s Greysens ae crackng one  skull

And thats  end Any questons  reccomendatons","worldbuilding",2,"https://www.reddit.com/r/worldbuilding/comments/11nbwcv/i_made_a_fantasy_race_recently_for_an_unnamed/"
"Got tired of crap looking maps. Made my own board and terrain5","2023-03-10",1678481770,"Got tred  crap lookng maps Made   board  terran","Scrap pece  cabnet grade Baltc brch  random peces  scrap wood  make modular terran   dd campagn","DungeonsAndDragons",1,"https://www.reddit.com/r/DungeonsAndDragons/comments/11o0lla/got_tired_of_crap_looking_maps_made_my_own_board/"
"73153","2023-03-10",1678418354,"KM Cotw What  r lore frendly companon bulds   concepts  mne","H

Kngmaker Call   Wlds
What  r lore frendly companon bulds
dd  make far n game chapterstart   major spoler plz f possble
mne   now low dffculty
gt Valere Fghtertactcal leader archetype twf heavy blade  bash n plan twf fent f ftslt
gt Amr BarbRage tactan archetype superstton rage lne  cleavelt
gt Harrm Warprset SacredFstorHolyVndcator Crusaders Flurry wth heavy flal anywaywolf style Destructon  Madness blessnglt
gt Jaethal Clerc Undead LordSacred Hunter Master Channel scourge  channel smte wth Scylt
gt Lnz BardEnchanment  Illuson feats knda want  force glave  herlt
gtOctava Wzard Eplotertransmutaton  conjufaton feats  sneak  AT lvls knda hardDragon  Ecclesurge gonna st home  lke Havent met  restlt
gt MCshades  ndecsve respecs wanna shapeshftlt
gtAll wll waste r frst feat  Bonded Mndlt
gtAll wll take Fates Favored tratlt
gtMelee wll take Pared Opportunstslt
gtCasters wth petsfamlars wll take Share spelllt","Pathfinder_Kingmaker",2,"https://www.reddit.com/r/Pathfinder_Kingmaker/comments/11nd4ps/km_cotw_what_were_your_lore_friendly_companion/"
"22109","2023-03-10",1678450913,"   fnd  shsat score breakdown","f  remember correctly last year re   shsat score breakdown avalable showed  score  got   secton etc maybe m just blnd  s somethng smlar avalable ths year  f   can  fnd t thank ","SHSAT",2,"https://www.reddit.com/r/SHSAT/comments/11nnpdy/where_do_we_find_the_shsat_score_breakdown/"
"How to deal with side talk at the table.4","2023-03-07",1678226285,"How  deal wth sde talk   table","My almostyears   game s almost   end That   longer campagn I ever ran At frst I ddnt know almost none   players I found   m   nternet  started  group wth  frend  mne I ddnt pck  choose  players    thanyears dmng  m  dd anor game around covd tmes I realzed   just dsruptve players    low  zero nterest   world  msson   dong That tends  lead   lot  sde conversatons  loud  sometmesplayers  talkng  I cant hear   player   hs turn s tryng   On  last game I called m   t  slowly  conversatons started  buld  back agan My net gamng group wll  defntely  thought  I ntend    player   whle  try  pck  choose players    bt  nterested n  story n front  m   least   respectful Anyway   I   try  mtgate  problem   last  sessons We   lmted number  sessons   spend  much tme  game  sde conversaton    pont  nvolvng almost  whole table","DnD",11,"https://www.reddit.com/r/DnD/comments/11lcrcs/how_to_deal_with_side_talk_at_the_table/"
"Thinking about Ranger3","2023-03-10",1678462420,"Thnkng  Ranger","I   thnkng    Ranger     bad reputaton   long    changed  ntroducng  optonal class features va TCE One   man thngs I  thnkng  s    thnk  Ranger  usually thnk   nature warror    pet

What I  thnkng s  f Ranger  worked n  way   get  eploraton abltes   pet   class core features I feel lke t   better  make  subclasses  lke  Drud subclasses enhancng  pet  beast master  rself wth swarm keeper

Does anyone else   thoughts  ths I feel lke f  beast master  just  core class t     ts  dentty  just  nature fghter  drud warror lke   Paladn s loved  ts auras  smtes

TLDR I thnk  rangers  just get beast master  subclasses  focus   lke Wldshape","DnD",11,"https://www.reddit.com/r/DnD/comments/11ns9cf/thinking_about_ranger/"
"41189","2023-03-10",1678413159,"Results  ChatGPT survey  foregn language learnng","Last month I shared  survey study I  conductng  ChatGPT  foregn language learnng Ive fnshed analyzng  data   lke  provde  summary   results For    nterested fgures related   results can  found   lnk 



Id lke  thank everyone  took  tme  complete  survey In total I recevedcompleted responses Respondents ncluded language learners ofdfferent foregn languages wth Japanese Englsh Spansh German  French beng   studed languages among  partcpants Notably  survey ncluded learners  several less commonly studed languages   Esperanto Turksh Tagalog along wthor languages   studed   sngle partcpant 

The  common uses  ChatGPT  foregn language learnng wereconversaton practcelanguage learnng materalvocabularygrammarandcorrectve feedback 

The Lkert tems pont scale  based   two prmary constructs   Technology Acceptance Model TAM Davsperceved usablty PU  perceved ease  use PEOU TAMbased results  medpartcpants  splt   PU  ChatGPT  foregn language learnng whle  respondents  favorable vews   PEOU  ChatGPT  learn  foregn language

Several mes  dentfed   openended responses The  frequently commented  mes wereAccuracyAccessbltyConvenenceLmted usabltyandPersonalzed language learnngThe mes related  accuracy  accessblty  ehbted n  postve  negatve ways Specfcally four respondents remarked postvely  ChatGPT accuracy whlehad negatve comments   tools accuracy For accessbltyrespondents comments  dentfed  postve  three  dentfed  negatve

Thanks agan  r help  feel free  leave comments  questons ","learndutch",0,"https://www.reddit.com/r/learndutch/comments/11nb47p/results_of_chatgpt_survey_for_foreign_language/"
"[Spoilers 6.35] Is it just me or..?13","2023-03-08",1678252170,"SpolersIs t just  ","Have  Mandervlle quests  teasng obvous bltzball moves snce","ffxiv",27,"https://www.reddit.com/r/ffxiv/comments/11ln2yw/spoilers_635_is_it_just_me_or/"
"50102","2023-03-09",1678399634,"bron hgh school  scence dscord server","congratulatons  makng t  bron hgh school  scence  proud  rself t wasnt easyjon  dscord server re   lot  upperclassmen  wll dscuss terms wth ","SHSAT",1,"https://www.reddit.com/r/SHSAT/comments/11n5f7n/bronx_high_school_of_science_discord_server/"
"Rokas Malinauskas Power Die sandbox system for managing NPCs, organizations and economies31","2023-03-09",1678334386,"Rokas Malnauskas Power De sandbo system  managng NPCs organzatons  economes","So I found ths cool dea n hs vdeo  n looked   correspondng blog post





But  revewng t  thoroughly Im afrad I dont actually understand t enough  get gong   

Is re anyone   heard  ths system  knows   run t n  detal  even better   reference descrbng ths system n detal And addtonally   know    smlar ways  quckly add depth  lfe   world behnd  scenes s somewhat smlar  ths power  system

For     want  tldr 

NPCs organzatons gulds towns  even kngdoms f d lke   power  Power   D D D D  D Enttes start  levelwth  D   can upgrade r power    net one  payng  fee n gold gold  levelng   power  s n  table n  lnked artcle 

After  sesson   entty roll r D  n f  succeed r power  The power  gets m  beneft A merchant wth  levelpower  D mght roll t  get aSo  mght craft two healng potons  sell two tems  make  gold n proft  recrut two people  workng n  shop  runnng odd jobs  whatever Rokas ddnt go   say much else    actons  power      types  NPCs  gulds  kngdoms 

So  ssue s  ddnt flesh  system  enough Wthout   nput   thought s  come  wth    actons     enttes  Sure Im  DM Im creatve  I can   But Id rar use someone elses work knowng ve already thoroughly thought  ths  balanced t somewhat

Thanks","DnD",0,"https://www.reddit.com/r/DnD/comments/11mi1rn/rokas_malinauskas_power_die_sandbox_system_for/"
"M3: The Android Avenger #ChatGPT #StableDiffusion #AI #Story #Blog #Superhero #SciFi #Fantasy4","2023-03-07",1678207111,"M The Androd Avenger ChatGPT StableDffuson AI Story Blog Superhero ScF Fantasy","M The Androd Avenger
ChatGPT StableDffuson AI Story Blog Superhero ScF Fantasy","ChatGPT",3,"https://www.reddit.com/r/ChatGPT/comments/11l452w/m3_the_android_avenger_chatgpt_stablediffusion_ai/"
"14721","2023-03-09",1678402742,"Can  ban chatGPT postsmove m nto  megathread","Im sorry   tool  bounce stuff   propretary advanced autocomplete engne  mostly ests  harvest rubes data   lttle   wth lnu    happen  call t   lnu bo    needposts  t   frontpage

And whle   heavly downvoted reddt sucks  stll shows posts wth negatve karma   front page

So    least   megathread  temporary ban  chatGPT posts  least   couple  weeks    credulous rubes wll  gvng r data  BngBardBoredAppClubTheNetBgThng

rChatGPT ests","linux",337,"https://www.reddit.com/r/linux/comments/11n6tq3/can_we_ban_chatgpt_postsmove_them_into_a/"
"[H] Company of Heroes Steam Key [W] $35 pp or something Equivalent1","2023-03-07",1678223548,"H Company  Heroes Steam Key Wpp  somethng Equvalent","I got ths one   frend   already bought t  steam And I    nterest n strategy games



Ths s  reputaton page  steamtrades  re  can see  add   steam  well","GameTrade",0,"https://www.reddit.com/r/GameTrade/comments/11lbizu/h_company_of_heroes_steam_key_w_35_pp_or/"
"Need some ideas of how to lead my players to their end goal","2023-03-07",1678219237,"Need  deas    lead  players  r end goal","I  frst tme dm  n wrtng   home brew story n  We  early    party  sent  retreve  artfact   arch Drud   Drud  save  town They    return   Drud  I wll reveal   s actually  campagns man antagonst I thnk  already suspect hm I gave  guy enough tools  kck  partys ass get  artfact  escape Wth ths artfact n  hands  BBEG  wll eventually get  sort  catastrophc event Im dong ths   party   clear goal n mnd wthout  just tellng m   goal   I want  party  seek   BBEG  defeat m  along  way  need  level   bunch  fnd  clues  lead m re My ssue s Im  really sure     n  way  snt ralroadng  party  I also want  leave space  re  personal quests 

A  fnal notes  contet I put m n   natury contnent   major settlements   odds wth  wld nature I wanted  eplore mes  colonalsm  ndustralzaton nspred  bt  prncess Mononoke 

So f anyone   tps  deas Id really apprecate  nspraton","DnD",3,"https://www.reddit.com/r/DnD/comments/11l9k7y/need_some_ideas_of_how_to_lead_my_players_to/"
"DM Appreciation Stories8","2023-03-10",1678465168,"DM Apprecaton Stores","Ive  seeng vdeos  artcles lately   shortage  DMs    shft n mechancs complety epectatons  DnD  turned  new DMs  takng  leap  runnng  game

The frst DM I played wth   genunely awesome guy  spent hours wth  outsde   game helpng buld  character created art   mnature token eplaned  core mechancs   frend n  group even lent   players handbook  get started The frst sesson I joned r ongong campagn  one    memorable eperences I   ths day re   epc encounter   rest   group saved  PC   evl wzard  helped  character eact revenge The DM   players   etremely welcomng  made  whole eperence loads  fun

I just really apprecate   tme  effort   DMs put n  brng toger  group  frends  share  sacred tme toger   table I hope ors  enjoyed  moments   understand  true sprt   game

Cheers","DnD",0,"https://www.reddit.com/r/DnD/comments/11ntgaw/dm_appreciation_stories/"
"27141","2023-03-06",1678109709,"Future  AI n smartphones","When   guys thnk  wll   AI lke chat gpt ntegrated n  phones I mean although   Bby Sr Google Assstant  doesnt seem  smart  chat gpt I really want  see  Jarvs  ron man sht lke lol

But really I thnk   phone wth  AI   actually chat wth  learn r habts   lkes  dslkes  remember     really nterestng 

You guys thnk    possble","ChatGPT",5,"https://www.reddit.com/r/ChatGPT/comments/11jz4b4/future_of_ai_in_smartphones/"
"Forgotten Realms Travel Time8","2023-03-10",1678477275,"Forgotten Realms Travel Tme","I mght  DMng  group n  fall  m thnkng  startng n  publshed adventure  n makng t  open world Out  curosty   wonderng f anyone knew   book  dm guld  somethng    dstances 
One locaton  anor n  Forgotten Realms f  party wanted  go  Waterdeep  Corymr  somethng","DungeonsAndDragons",2,"https://www.reddit.com/r/DungeonsAndDragons/comments/11nyol0/forgotten_realms_travel_time/"
"Free Charity One-Shot (Rivers of Pollin)6","2023-03-08",1678289622,"Free Charty OneShot Rvers  Polln","Its  For  past  months I   workng   orgnal story   DD one shot All  proceeds wll  gong   Bumblebee Conservaton Trust Its   really fun tme workng    art  creatng  fun story  helps rase awareness   conservaton Hopefully ths story leaves  wth  sweet concluson 

You can fnd  book  Rvers  Polln

Also donate   bumble bee conservaton trust  Donate Here","DnD",0,"https://www.reddit.com/r/DnD/comments/11lzcup/free_charity_oneshot_rivers_of_pollin/"
