"","date_utc","timestamp","title","text","subreddit","comments","url"
"I feel like my urban fantasy world with realities poking in is too cliche, what can I do to make it more unique?2","2023-03-10",1678421314,"I feel lke  urban fantasy world wth realtes pokng n s  clche  can I   make t  unque","The world s present day Amerca set n  fctonal state  Lncoln Its rfe wth tears n realty  cause alternate hstores  wander n If  tears arent closed   threaten  rp apart  realtes They also alter  memores  people wthn  certan dstance convncng m  ts always  re
Maybe res  htech modern zggurat  n  desert   army  crusaders bearng    college town

But wth   multverse  alternate hstory stuff gong around  days I feel lke ths settng s  clche 

How can I make t  unque","worldbuilding",4,"https://www.reddit.com/r/worldbuilding/comments/11ne82z/i_feel_like_my_urban_fantasy_world_with_realities/"
"19622","2023-03-10",1678425746,"P Lookng  ML Buddes  Start Freelancng Toger  Buld  Supportve Communty","upd dcord lnk
upd ths   small actually alreadyplease   confused  help us organse ths n  proper way


TLDR

Lookng  ML buddes   level preferably begnners  want  start freelancng toger The goal s  buld  small local communty  ML enthusasts  can support    echange knowledge We wll use freelance collaboraton   man actvty Were also lookng  eperenced mentors pad  unpad  gude us

Etended

I beleve  learnng  growng n  group s much  enjoyable  effectve Thats  Im tryng  create  communty  lkemnded ndvduals

Im lookng  create  small local communty  people   startng  n freelancng    nterested n mutual support Our man actvty wll   Dscord channel  members can post r work  collaborate  projects wth payment splt  agreement Addtonally  plan  engage n actvtes   knowledge echange lve codng supportng  ors pet projects  hostng study sessons

Ths communty wll  small  focused wth members  can trust    share smlar goals Were also lookng  eperenced mentors  can provde gudance   navgate  world  ML freelancng Wher pad  unpad  welcome  support  advce

About  Im  yearold selftaught ML enthusast  Russa Although I    eperence n freelancng Im eager  start takng  frst steps towards makng money  ganng eperence As  begnner Im hopng  connect wth ors     smlar level   also lookng  grow

 tet s chatgpt supported  prevet grammar ssues sound  natve  clear","learnmachinelearning",27,"https://www.reddit.com/r/learnmachinelearning/comments/11nfri6/p_looking_for_ml_buddies_to_start_freelancing/"
"your experiences with online DnD.","2023-03-07",1678180453,"r eperences wth onlne DnD","Been lookng  gettng n  DnD   whle now Due   workng pattern  lvng locaton  struggle  fnd  tme  get anywhere durng socable hours

Seen places lke Roll  wonderng   general vew  eperences ve   f ts worth pursung

Thanks n advance  r tme readng  answerng","DnD",15,"https://www.reddit.com/r/DnD/comments/11kuc0w/your_experiences_with_online_dnd/"
"Chat gpt and game development2","2023-03-08",1678296023,"Chat gpt  game development","I    queston one  dreams  mne ts  created  vdeogame  necessarly get rch    make  dream gamemy dea ts   ambtous I thnk d resources  pretty basc d assets

But I haveof programmng knowledge  whle I   necessarly aganst  dea  learnng  I   love  learn n  lfetme Its  eactly I  dyng  learn

So I started  ask  chat gpt  game development wth     deas   I eactly need n term  resources  make game along  lnes   I started  ask     t t started  gve  code lnes  unty  I asked  ths specfc game engne

I    questons

How good ts code  chat gpt provde

    take ths code I mean re   copyrght nfrngement ssues f took t    place wth copyrght rght","ChatGPT",3,"https://www.reddit.com/r/ChatGPT/comments/11m25sn/chat_gpt_and_game_development/"
"69","2023-03-08",1678280181,"Brawler Gene buld deas","So  net campagn meant   wll  run  pfe nstead  weve sunk  teeth nto  BB  AV
Trouble s   Fre Genas Warlock Gene I made  I  allowed  use  homebrewed melee Eldrtch Blast   ablty  grant scalng better wshes traded   flyng feature  lvl  weak wsh grantng
Would lke   ths wth lttle   homebrew f possble  t stands  character   translate perfectly  Pathfnder  far  I can make hm

Any deas owseones

B

Core fantases

 Melee brawlerhandtohand  prmary combat method
 Grant wshes   etend hopefully asap   need   magc
 Ifrt Gene feel even better f bound   lampobjectholder   power   wsh

B

My dea  far ths  lkely  fare well n melee  m lackng  feel  beng  Gene

 Gene Bloodlne Sorcerer
 Lavasoul   melee damage
 Martal Artst Archetype","Pathfinder2e",3,"https://www.reddit.com/r/Pathfinder2e/comments/11lvowm/brawler_genie_build_ideas/"
"What is the highest hitpoint maximum a player get without magic items?","2023-03-07",1678199923,"What s  hghest htpont mamum  player get wthout magc tems","Was talkng  someone  Grog beng  walkng health bar  made  wonder  hgh  can actually get wthout magc tems ths s somethng  dm controls  good  math  wth  average htpont gans per level  ths s  totals  level twenty barbaranconsttuton wth barbaran capstone 

Hll dwarf 

Toughness 

Average Ht Dce bonus d 

Con bonus

Total 

Ma total possble ht dce bonus 

New Total 


Can anyone get hgher  ths Im gnorng oretcal health   moon drud stuff  temporary htponts You  add  Ad spell  th level   addtonalhtponts  Boon  Forttude s also  addtonalfor  new ma oftotal htponts  s wth DM approval  assstance  anor player 

Im aware ts  practcal  get ths hgh  numbers can  fun

Edt  people  askng  ma htdce potental  I added t  s  relable whch   reason  ecludng magc tems boons etc Its added now tho re welcome","DnD",25,"https://www.reddit.com/r/DnD/comments/11l11wd/what_is_the_highest_hitpoint_maximum_a_player_get/"
"[FOR HIRE] GOBLIN ON THE THRONE","2023-03-09",1678320522,"FOR HIRE GOBLIN ON THE THRONE","Artst lookng ","HungryArtists",0,"https://www.reddit.com/r/HungryArtists/comments/11mcvmf/for_hire_goblin_on_the_throne/"
"Help optimizing my first DnD character! :)","2023-03-09",1678396033,"Help optmzng  frst DnD character","Hey everyone

I  n  process  creatng  frst ever character   upcomng campagn I wll take  part n Snce  DM promsed  tough  far campagn wth  need   slghtly  optmsed characters I just wanted  run  character     can tell    looks lke n terms  stats optons   Keep n mnd  I  new   knd 

Race Gold Dragonborn

Class Paladn

Subclass Oath  Vengeance

Stats  bonuses

STR 

DEX 

CON 

INT 

WIS 

CHA 

General personalty Gruff stoc serous character wth  hdden soft sde   etreme desre  purge  world  everythng evl corrupt  tyranncal Ends justfy  means  mercy   wcked I wll lay   sword    type  character  s ready   whatever may  necessary   greater good

Thanks guys","DnD",3,"https://www.reddit.com/r/DnD/comments/11n3ts5/help_optimizing_my_first_dnd_character/"
"Unable to connect or even start the game.6","2023-03-08",1678292046,"Unable  connect  even start  game","Today I tred loggng n  XIVlauncher sad t couldnt get Steam  auntcate  I n tred  Steam tself  got   type  message Is anyone else havng ths ssue","ffxiv",12,"https://www.reddit.com/r/ffxiv/comments/11m0ef4/unable_to_connect_or_even_start_the_game/"
"Very problematic Player4","2023-03-08",1678261676,"Very problematc Player","So ths s  frst post  ths subreddt  I  really lookng   advce Theres  player n  party    causng ssues snce  nd sesson   s   murder hobo   rules lawyer  anythng lke  

What   s  complans every sngle tme somethng doesnt go  way  wants t  whch means anytme anyone  anythng remotely bad I  say  ths s aperson partyof  members  part   mafa n game   crmnals whleors  just  bt chaotc 

To gve  eample   bad thngs get Out  game  complaned     gotten  carrage full  hostages klled snce  wzardwho s usng  homebrew class That  dm checked made  rune  casted fre ball  every ndvdual wthn ts range So re waspeople  sfreballs All gong    In    close space Bascally   eploded  whole carrage  made  mnor fre plane n  snow forest He complaned  two days   game  ths one thng And    nd

Theres  thngs I can say  t  make ths post way  long I honestly dont know   deal wth hm  pretty much everyone n  group s fed  wth hm   pont   members  plottng  kll hs character   just cant play","DnD",27,"https://www.reddit.com/r/DnD/comments/11lq2q4/very_problematic_player/"
"1682","2023-03-08",1678245828,"Dsable flters n API","Workng wth ChatGPT GPTTurbo s ncredbly frustratng  compared  workng wth GPT    bullsht flters I get   publc chatgpt webste  m    hell    gve devs  opton  dsable m  provde   flters In ts current state  ChatGPT ap s completely useless f  want   anythng  goes even  lttle bt outsde OpenAIs flters GPT never  ths problem t just warned ","ChatGPT",2,"https://www.reddit.com/r/ChatGPT/comments/11lktep/disable_filters_in_api/"
"API token limitations vs ChatGPT2","2023-03-08",1678305445,"API token lmtatons vs ChatGPT","How s APIs ma conversaton lengthtokens yet ChatGPT can make seemngly nfnte chat hstory   sngle go Is re somethng I  understand   API Ive fgured  usng API I  feed  whole C project   AI yet t cuts   couple  long scrpts CodeGPT plugn workng smlarly

Yet  ChatGPT I  send  long scrpts    problem    responses  beng cut Is re  dfferent tech behnd t","ChatGPT",2,"https://www.reddit.com/r/ChatGPT/comments/11m6cc1/api_token_limitations_vs_chatgpt/"
"Feedback Friday2","2023-03-10",1678431646,"Feedback Frday","Hello rBaldursGate

B

Its Frday whch means  ts tme  gve r feedback  Early Access Please try  provde new feedback  searchng ths thread  well  prevous Feedback Frday posts If someone  already commented wth smlar feedback    want  provde please upvote  comment  leave  chld comment  r  provdng  etra thoughts  detals nstead  creatng  new parent comment

B

Have  awesome weekend","BaldursGate3",3,"https://www.reddit.com/r/BaldursGate3/comments/11nhq4i/feedback_friday/"
"Reskinning a paladin to strip out the magic?2","2023-03-07",1678224628,"Resknnng  paladn  strp   magc","Hear  


My DM  agreed  allow   play  gnoll   use paladn rules  abltes specfcally  oath   crown Ner  us care  ths snt eactly raw   actual gnoll pally feels  lttle dsjonted  I suggested  reskn  abltes   agreed


Some  easy   lay  hands  can smply  hm tendng  wounds n varyng degrees  compelled duel  smply  hm yellng  form  bat   npc takng t   dependng   roll


The ssue comes wth   magcal abltes   dvne smte    etra radant damage come  Healng  dstance     work


Any suggestons   awesome I may also  able  run mnor tweaks   rules   DM f t goes along way towards makng thngs  lttle  matcally coherent","DnD",14,"https://www.reddit.com/r/DnD/comments/11lc0bl/reskinning_a_paladin_to_strip_out_the_magic/"
"PvP magic items2","2023-03-07",1678147463,"PvP magc tems","What    best PvP magc weapons Im ths PvP set  tsteams  duos  lvlwe can havemagc weapons rarty s rare  lower","DnD",0,"https://www.reddit.com/r/DnD/comments/11kiujx/pvp_magic_items/"
"10928","2023-03-09",1678398539,"I  nothng unque  valuable  say  Im just gong  dump  ChatGPT garbage  ltbrgt JUST KIDDING The endowment  currently  snt even close    one Joe Smth taught","Hear   The endowment  undergone changes egbut  mportant    I can see  apologetc argument    modfcatons   orgnal However Brgham Young sncerely beleved  GodElohm  AdamMcheal    person From hs perspectve t    made sense  Elohm  drect Jehovah  nturn drects Mcheal  buld  world Had JS tred  teach   BY     lke

So Elohm told hs   tell Hmself  buld  world I  get t

Apparently  ongong restoraton s just makng  sht untl  get called   t I cant   frst  notce ths ssue If anyone knows  ths contradcton appears n earler lterature please pont  n  rght drecton","exmormon",0,"https://www.reddit.com/r/exmormon/comments/11n4xk3/i_have_nothing_unique_or_valuable_to_say_so_im/"
"The Role of Dice - Part 1 - Rolling for Skills2","2023-03-06",1678092219,"The Role  DcePartRollng  Sklls","H folks just  frst   short seres  polls  DMng   way  use  dce  r tables ths one  rollng  sklls Of course  DM can ask players  roll  skll  attrbute    players    want  roll one   DM   asked

Vew Poll","DnD",21,"https://www.reddit.com/r/DnD/comments/11jt98j/the_role_of_dice_part_1_rolling_for_skills/"
"Asking for product niches that will be the most profitable","2023-03-08",1678290119,"Askng  product nches  wll    proftable","Jalbroken ChatGPT seems  push hard  ecofrendly socally conscous products ChatGPT s defntely tryng  drect nformaton back  globalst BS It seems   one   bggest flaws wth  system The  proftable products  sell   certanly  just products  fght clmate change It told   f I want  start  proftable busness ths year one product  focus  s reusable menstrual cups I ddnt even know    thng Thats lke f I asked t   make  mllon dollars ths year  t sad sell washable reusable dapers","ChatGPT",2,"https://www.reddit.com/r/ChatGPT/comments/11lzkcx/asking_for_product_niches_that_will_be_the_most/"
