"","date_utc","timestamp","title","text","subreddit","comments","url"
"27148","2023-03-10",1678465918,"Lets Have Fun Wth Arcane SpellsEnchantment School A seres n whch I tell   bunch  thngs  can  wth   Arcane spells n  game","A school wth    spells  yet      character lmt agan lol   fnal secton s n  comments



Frst   heres partof  seres Necromancy f  mssed t

Second  ths s  school wth fewer spells  cover     lot   spells    less   thng charm  leave  enemy helpless Im also gonna talk  lttle bt  Enchanters mselves    Enchantmentrelated tems

Thrd I cut   t  secton  eplans   spell   ths   future threads cause  Necromancy thread  ths one went beyond  character lmt  re   schools  cover    lot  spells  f   know  absolute bascs just read  ngame spell descrptons  obvously Im stll gonna pont  whats  covered  m  well      noteworthy ponts

Importantly f  spell gnores magc resstance Ill menton t orwse t doesnt



ENCHANTMENT

Charm Person

To avod repeatng thngs  general charm strateges  covered n  separate secton near  end  check   later

Dont forget  ths spell  affects humansze humanods  smaller    spell descrpton  provdes eamples ts   ehaustve lst eg Mephts   lsted  yre affected

Castng tme ofs amazng That means  can even use ths  spellcastng dsrupton preferably f re  Enchanter cause Mages  good saves though   crappy saves n BGEE Look   charmng one  wth  MageThef thats gonna show   lot later

A save vs spells wth abonus mght  seem great  keep n mnd  tll stll work well aganst  lot  creatures n BGEE  even BGEE Ths s   DD ts  well wth    elements thngs  keep scalng  absurd levels For eample Ragefast  actual named Mage   fnd n  mdlategame area   save vs spells ofand r average Bandt lke  n  Bandt Camp   crappy save vs spells ofThe worst ll generally run nto n BGEE outsde  Sarevok hmself s  save vs spells oflke wth goddamn Ettercaps    Sarevoks companons   fnal battle n BGEE  even   stll techncally vulnerable   regular Mage usng ths spell Dont ask    rando lke Zordral  Mage threatenng  lady n  Nashkel Carnval tent   save vs spells ofwhch s better       aforementoned fnal bosses The fuck

Not gonna spend ages lstng savng throws   just  gve   dea   enemes  smply scale  absurd levels even n Throne  Bhaal thnk  Senda yes  hasmagc resstance  s mmune  charm thats   pont Im  tellng   use ths spell aganst  Shes  major boss n Throne  Bhaal  whats  save vs spellsIts worse  freakng Zordrals  dude whose name    look   remember  thnk   knd  saves r average mob  even n Throne  Bhaal  s worse   mght epect  godlke stuff

Enchanters   massve advantage usng ths You can just flng t left  rght  throughout  game  re bound  charm  lot  people wth  save vs spell wth abonus I mean thnk  t Dre Charm s  levelspell thats eactly lke ths one ecept wthout  save bonus  wth  longer castng tmevsSo  Enchanter bascally turns  levelspell nto  levelone stll hasbonus  t  better CT

A lot  humanods  ofc humans  tend   regular classes   wear  saveenhancng gear  f  know r savng throw progresson tables  can fgure   mght  good  bad save vs spells eg prest  warror classes tend    worst whle rogues  wzard classes   best Regardless I thnk   try  charm even creatures wth good saves lke Mages cause f   get t  effect s massve  f     wasted  levelspell   round   worst thng n  world

All  need s  chance  ths  work  t  beng mpossble cause  can mprove r odds wth saveworsenng spells  f re  nonEnchanterInvoker puttng ths nto  Mnor Sequencer

But actually EnchantergtThef duals can put ths spell nto  Mnor Sequencer eventually   get Use Any Item It just takes  scroll But  can actually  t wthout scrolls  learnng  spell va  eplotng wth UAI I eplan t n  secton  Enchanters  tems  I talk  dualng Enchanters nto Theves I thnk ts  far eplot cause f  can cast t   scroll already n  cant  scrbe t Plus ts   super easy thng  accomplsh You need UAI   Specalst Mage As  former DM I gve  permsson  use t lol



Frends

BGEE   lot  reactonrelated  just Charsma  many people thnk Charsma s just  part  reactons  reacton takes nto account r reputaton  well rewards  even companons  requre  bare mnmum  er Charsma  reacton  jon BGEE   lot less    res stll  stuff  happens especally   lower end eg  need  pay  get nto  back rooms   Copper Coronet f r reactonCharsma s  crappy

Most mportantly ths allows   easly reach Charsma cap  shop dscountseven n BGEE



Sleep

Classc BGEE cheese spell wth  looooooong duratonrounds per level   massve area  effect  bt larger   Freball IIRC Sleep s one   least ressted effects  re ecept  n Undead  Elves  enemes reman helpless throughout  whole duraton ecept n Icewnd Dale Enhanced Edton   wake   gettng ht 

Take note t rolls  save vs death wth apenalty  vs spells Dont ask   though

Also worthy  note s  ths spell actually   worse level coverage   Clercs Command  t comes  t workng wthout  save Ths doesnt affect creatures  levelwhle  Clerc spell  nflct sleep  levelenemes wthout  save

Levelsstll cover  sgnfcant enemes n BGEE  eample Ankhegs yre  levelIn fact Ankhegs  stll leveleven  found n BGEE   Corrupted Ankhegs n EEonly content   level 

In ory  can level dran enemes  m   affected  ths even n BGEE wth  Totemc Druds Sprt Wolves  levelbut snce ts  castanddone spell  opposed  say  cloud  lngers ts nearly mpossble  know   enemes  reached  low enough level   affected   n cast  spell Plus  level s SO low ts  really compatble wth  majorty  leveldranng effects hgh level stuff

If re  Sorcerer  get ths spell cause  can use t va  Wand  Sleep nstead whch  classkt can use ecept  Wzard Slayers Or hell cast t   scroll ts cheap

Put  group  enemes  sleep  n let r Famlar fnsh m  whle  take care    ressted   mmune especally f  enemes put  sleep  equpped wth ranged weapons  takedamage per ht  melee attackers     Imp famlar  can just turn nto  Bearattacks per round  good damage

Even   Mage  can equp  offhand weapon  get  etra attack per round aganst sleepng enemes You autoht anyway   cares  THAC penaltes And  forget  can change weapons freely durng combat



Luck

Bt   meme spell due  ts ncredbly short duraton ofrounds    effect s bad

Ato luck means  bunch  thngs  manly  Mages t means  enemes can never get lucky  ht  wth meleeranged attacks past r Mrror Images So n ory   combne ths wth Mrror Image  get somesafe protecton  n keep reapplyng Luck   duraton s 

Most mportantly ths doesnt just provde Luck t also mproves Thevng Sklls multple casts   cumulatve unfortunately byncludng    etremely hard  mprove orwse wthout levellng Set Traps  Dspel Illusons Ths means  f r Thef  Famlar saway  beng able  fnddsarm  trap  open  lock beyond  normalrange cause  can open  dffcultylock wthOpen Lock  can use ths spell  make m succeed n 

In  rare case  can also use ths   MageThef  acheven pckpocket n BGEE f  happen  havewthout  use  potons  res  gear  ncrease pckpocket n BGEE    NPCeclusve tem As well see later n  charm sectonn pckpocket s  pretty mportant breakpont   awesome tactcs

In ory  Thef even one wthponts n Detect Illuson can get achance  dspellng llusons formeasly rounds va ths spell Yes Ive used ths   Rabbt Famlar  allow t  dspel  enemys Mrror Image n  past just  test ths t hlarously works



Ray  Enfeeblement

Anyone outsde  r party doesnt need  worry  encumberance   dea doesnt work unfortunately

Even  weakest enemy  encounter wll   leastSTR  means ths spell  lowers t toforroundlevel wll    least nflct apenalty  THAC andpenalty  melee damage yes  throwng tems  well whatever

A lot  warrortype enemes   leastSTR n BGEE thats apenalty  THAC andpenalty  melee damage See  Im gong The stronger  enemy  better ths spell s And even  crappy  almostcrappy BGEE enemy wll suffer   decent penalty  t Use ths   dragonSTR  yll get apenalty  THAC  apenalty  damage Too bad Demogorgon s mmune  levelspells

AFAIK re   enemes n    games   mmune  stat dran n fact res  protecton aganst t whatsoever   avodng  spell entrely   attack f thats  cause None A   protecton aganst dyng  reachngn  stat   aganst  stat dran tself

If  get ht  ths though res  bt   workaround wearng STRenhancng gear  usng spells  setmprove r STR

Ths s partcularly great  combned wth good armor class You can already reach etremely low AC even   pure Mage  f  combne  wth  THAC penaltes  can easly fnd rself n  stuaton   enemy can  ht   rollng  crtcal ht Therefore  EnchantergtFghter dual  dualed  levelcause orwse  duraton    short can put ths  great use whle wearng  sheld andor ACenhancng helmet    always f  wanna know  detals  ACstackng  tank anythng n  game I wrote  t  long tme ago  ofc ths spell makes  even easer

Its  levelspell   agan t fts nto  Mnor Sequencer whch agan even EnchanterTheves can use



Dre Charm

Not much  say  ths one Its Charm Person  levela lttle bt slower  cast CT vs CT  t doesnt gve  enemy  bonus  save whch means Enchanters nflct  ecellentpenalty   save  opposed  bonus  Charm Person Read  Charm Person part    general charm strateges part 



Hold Person

Ths s gonna    wth many  ths seres posts  Ill say t agan holdparalysssleepstun effects can pretty much  consdered nstantdeath effects f  last longer  one  two rounds hell one round alone s enough  kll  creatures especally f   summons andor party members  help fnsh m  And ths spell holds forrounds

Be sure  dualweld weapons  attackng held enemes   autoht It doesnt matter  r THAC s  f re  pure Mage

Unlke  Dvne verson  ths spell  Arcane verson actually nflcts apenalty  casts faster wth  CT ofnstead ofThat means Enchanters nflct  massvepenalty  saves aganst ths

The area  effect s really small  ts hard  get  thanenemy f   know  re dong  can let enemes surround    summonparty member  cast  m  get multple enemes  ts stll amazng  havng  area  effect Why Because  means ts  affected  Mnor Spell Deflecton Mnor Spell Turnng  Spell Trap In fact besdes m makng  save   falng r magc resstance roll   ways  Mages  protect aganst ths  Mnor Globe  Invulnerablty  Spell Immunty Enchantment ClercsDrudsShamans can cast Chaotc Commands  Free Acton   wont see many dong 

The man problem wth ths s enemes   just mmune  Hold perod lke Trolls However pretty much   m wouldnt  affected  ths spell  begn wth cause yre  humanszed  smaller humanods

The fact ths lasts forrounds perod s ecellent  early Enchanter duals  eample  levelwho  need  worry  havng  short duraton due  scalng Get surrounded  humanod enemes cast ths centered  rself cause  need  target someone  somethng   AoE wll  centered   someone  somethng  vola re surrounded  held foes

Held enemes can act  sheldsbarrers A lot  enemes comng towards  Hold two  m n  doorway  suddenly   enemes wll  able  ht  n melee Enemes wont attack   even f yre blockng  way  yre just gonna stay re blockng Ths s   naturally long duraton  ths spell s great Bascally t allows   focus   enemes frst  opposed   shortduraton hold effect  makes  focus  kllng  enemy whle ts held

Ill show  eamples   strats later n  Hold Monster part



Confuson

Unlke   mght thnk ths snt smply  worse pck compared  Emoton Hopelessness Both spells  r uses

Confuson mght  prevent  enemy  attackng entrely   t prevents m  castng spellsusng certan abltes dependng   creatures AI scrpt b wll  lkely prevent enemes  attackng  f re  close  m c makes enemes attack   untl  duraton s  whereas f  say charm two enemes  make m attack    charm wll break    f   charm one   mght attack  f r charmed creature s unable  draw aggro plus  can Freball etc confused enemes freely unlke charmed foes d t affects Elves   creatures mmune  sleep   confuson lke dragons

There s   ncepenalty   save aganst ths Ths s huge Combne t wth  Enchanters specalst penalty  ths spell becomes essentally    Chaos cast   regular Mage  spell  one level hgher Cast  levelspell wth  levelslot  good s 

A  fun thngs  can  wth ths s  cast t n  room whle blockng  door  enemes   lkely   close     consequently  lkely  ht   b cast  symbol death  enemes beat    enough  hopefully  belowhp always fun  see  bunch  enemes gettng nstaklled  

Just lke wth charm less creatures  mmune  confuson   mght epect  yre   less     ones mmune  charm   whch I menton n  charm secton

One weaker part  ths spell s  t doesnt last  long  t lasts  enough IMO especally consderng  save penalty  ts easy  reapply f  want



Emoton Hopelessness

You know t  love t Sleep s  rarelyressted status effect ecept wth Undead  Elves  t leaves enemes completely helpless  ts duraton allowng   r party memberssummonsfamlars  autoht m

Obvously Enchanters can put ths  amazng use due   penalty  nflct whch  spell lacks Consderng   hold  sleep spells  Enchantment school gets  mght  well roll wth  hghSTR dualweldng Enchanter  just keep makng enemes helpless  keep walng  m wth r Mage I show  eamples later wth Hold Monster

Of note s  fact  almost  Demons  vulnerable  sleep Ths s better eploted  usng  Pe Prck whose onht sleep effect gnores magc resstance  res nothng stoppng   lowerng  Balors   Glabrezus magc resstance  usng ths spell nstead

Note  res actually  secondary effect  caster becomes mmune  fearmorale break   duraton   spell  well So f  know  Mage lkes  open fghts wth Horror  eample n  even bor protectng rself aganst fear just start wth offense usng ths spell   try  put m  sleep  protect rself  fear   plus  probably  roll around wth Resst Fear memorzed   Mage   Nor   pck t   Sorcerer So  can just use ths nstead

The descrpton  ths spells duraton s bzarrelyworded ts justroundsper level  werdo devs



Enchanted Weapon

One   best thngs   Enhanced Edtons gve anythng aEnchantment Lasts  long tme  And t gnores magc resstance wat    matter

Whats one   bggest weaknesses  many shapeshft forms  summons The fact  ht  normal weaponsormeanng  cant face    strongest enemes n  game Well problem solved Salvaton  Shapeshfter Druds Avenger Druds Anmate Dead Skeletons Polymorph SelfImp Famlar enjoyers Anmal Summonng s Wnter Wolves enjoyers yre lke wolves wth machnes guns   strke  normal weapons      forth

Love Belmn r offhand What   Kundanen r offhand  well And  Dagger  VenomArdulas FallThe holdonhtnflctng Flamng Long Swordfrom  Rod  Lordly Mght one    underrated weapons n   games Jhor  Bleeder The Gnasher club Valygars katana Keldorns awesome eternalOPFresheldswordMalakarto protect aganst slashng attacks Namarrathat  damage lke aLong Sword Adjatha  Drnker Then  gotta love ths spell

What   Staves  FreArEarthThey can nstantly kll elementals   nasty Elemental Prnces n Throne  Bhaal ImYanCBnOgremoch can   ht wthweapons Well problem solved Elemental Prncesnstaklled

One somewhat nonsenscal thng  can  wth ths s f  somehow happen   Protecton  Magcal Weapons scrbed n r grmore   Protecton  Normal Weapons  can cast ths   enemy  strkes wth normal weapons eg  Master  Thralls n  Astral Prson  enchant r strkes  make m  blocked  Protecton  Magcal Weapons Yeah Thats  I mentoned  ths spell gnores magc resstance lol



Greater Malson

Apenalty   savng throw s already pretty substantal Apenalty s huge Combo ths wth  specalsts penalty andor wth spells  already  r  penaltes  Oof

For eample  TransmutergtClerc castng ths followed   Earthquake Inflcts  total ofpenalty  enemy saves aganst  Earthquake effect Whos savng aganst  A levelFghter    rollto  able  overcome t

Hell just  pure Enchanter can cast ths n Chaos  nflct  total ofpenalty aganst  Chaos effect Thats aroll needed    levelFghter

Everybody knows  can combne ths wth  PaladnClercRangerDrudShamans Doompenalty  saves  one fun thng   s combne t wth  Shamans Sprt Fre   achance  nflct Doom  everybody yeahchance   cast   bg group t happens  lot   can cast agan  agan cause re also dong damage n  Freballszed area Thats two areawde savedebuffs

Dont forget ths spell also nflcts penaltes   saves  just vs spells Thnk   many weapons cause nstantdeath effects onht   faled save vs death I love  use ths along wth  Slver Sword  see  bunch  souls leavng  enemes bodes Plus ths means  ths can also make Wal   Banshee super effectve  ts  AoE death effect  rolls  save vs death

Its knd  annoyng  start  fght wth  debuff lke ths cause  waste  crucal frst round  somethng  doesnt   mmedate effect   couldve  tryng  kll r enemy  charm m  whatever Well n  You can use  Chan Contngency  cast t  whatever enemy  see frst   can also  t earler va  regular Contngency thats centered  rself er run fast towards enemes wth  hasted Mage wth  sees enemy trgger  let rself  ht  trgger  ht condton Dont forget contngences arent super mmedate  take  fracton   second  trgger  ts easy  just rush n  let rself  surrounded    sees enemy condton trgger  ts convenent

Ths fts n  Spell Trgger  well   careful cause  projectle s pretty slow  ll often ht wth r  spells   Greater Malson projectle hts m



Chaos

Confuson ecept  level hgher  nflcts  furrpenalty total ofSame thng     really really really wanna make sure everybody gets confused



Domnaton

Not merely Dre Charm wth  ecellentpenalty   save cause t also works  nonhumanods Ill talk    good charmng  monsters s n  charm secton

A castng tme ofmeans ths spell can  cast nstantly wth  Robe  Vecna   Amulet  Power Ths s mportant  ths s  strongest Arcane charm spell  tem ablty n  game  res  Mass Charm  nstead   can  s spam ths spell  several enemes va Improved Alacrty  sort  emulate Mass Charm

Ths apples   spells wth penaltes ofc   forget   penalty snt just  better chance  ht wth  spell t can also    reason   spell works   enemy   For eample Sarevok   end  BGEE   save vs spells ofso wthout Greater MalsonDoom etc  cant affect hm wth  spell  smply rolls  save vs spells  need  penalty  affect hm That means Domnaton works  hm rght    gate even f ts wth  smallchance So  know ts easy  go crazy wth Power Word Reload  just spam t untl t works  hm f  want sound   reloaders furously typng n  dstance



Feeblemnd

The nstakll  end  nstaklls  enemy cant  anythng permanently ts  nstakll Youll  hardpressed  fnd somethng mmune  Feeblemndedness n  games  I can thnk   major bosses lke Demogorgon  Melssan plus Trolls funnly enough And t  apenalty   save wtf Enchanters castng ths  bascally gods

Ths works even aganst  super bosses For eample ts one     status effects  works  Abazgals dragon form So yes even Abazgal can  oneshot

Ths spell dsables  sorts  scrpts  creatures whch means res  nearlyunlmted amount  cheese  fun stuff  can  wth t For eample  can prevent creatures  turnng  bluecrcle  redcrcle You know  merchants  sell  sorts  cool goodes n Neeras BGEE sdequest The ones n  Red Wzard Enclave   supposed  turn red   start attackng  place Well  can Feeblemnd m beforehand fght n come back  cure  feeblemndedness  yll reman bluecrcle creatures  sell  cool stuff

Anor eample  can use ths   able  pckpocket  creature freely wthout consequence Sure res  chance  Feeblemnd tself wont work  f re  Enchanter  save wth apenalty s pretty hard  make  r Thef doesnt   lot  ponts n pckpocket ts  pretty easy way  let m try  try  try  pckpocket

Bascally f  want  creature scrpt   trgger   specfc pont ths s often  good way   t

Fun fact techncally ths snt  permanent effect t just lasts S hundred thousand rounds orrealtme days And ths also means  dyngrevvng cures t



Hold Monster

Same strateges mentoned n relaton  Hold Person work   well ecept  can  t  every creature n  game thats  mmune  hold

Once agan ths  apenalty  saves aganst t Knd    wth Enchantment spells Absurdly powerful   Mage  godlke n  hands  Enchanters

Sure  duraton sround per level   bare mnmum srounds even f  cast t va scroll  Nahals Reckless Dweomer  t always lasts  least  decent tme Once agan  can consder t  nstakll

Heres  eample  one   tactcs mentoned n  Hold Person secton   Mage  Necromancer n ths case  even  Enchanter lettng   surrounded  n cast ths centered   I mean  can reduce  castng tme towth  Robe  Vecna   Amulet  Power      can use StoneknMrror Imageetc ofc Look   effectve  save wth  penalty ofalready s  r average mob   much  effectve lettng rself  surrounded s normally   get ths many creatures wth one cast

Heres anor eample  also uses  charmed Carron Crawler   left porton   map  hold  Mage  Draug Feas party   fght even starts Agan ths s  Necromancer   Enchanter  Im  usng Greater Malson  anythng lke  plus Draug Feas party snt super low level Apenalty s huge

Fnally heres  eample    use hold  weaker enemes  create  wall aganst naster foes I ddnt fnsh  fght cause I ddnt   Boomerang Dagger  Enchanted Weapon memorzed  actually  able  ht    vampres  wth ranged attacks You  just cast spells nstead  usng ranged attacks well t depends  Skull Trap  Freball mght kll  orc wall  eample

EDIT I thought  Demons  mmune  hold effects  I just checked  yre  Ths spell just got even better



SOME NOTES ON ENCHANTERS AND A FEW ITEMS

Lots  tem effects beneft   Enchantment specalzaton nflcng thatsave penalty  saves res    less complete lst  tems   type   wk just scroll   fnd t Of note  Enchanters s Wands  Paralyzaton  Fear yes  fear one s ted   Enchantment school  Necromancy  Staff  Ars Sleep Cloud great   Elf  s bascally mmune  sleep  use  Eyes   Beholder  three effects   Rng  Human Influences charm person effect So   can see  Enchanter gans  LOT  etra frepower  tems especally  dualed one

Enchanters     best Mages  dualng Not    get access   tems  get  power wth ths specalzaton eg  Eyes   Beholder whch pure Mages cant equp   can also access ALL spells   Enchantment school  levelonwards So  can dual pretty early  stll get   spells  r chosen school

As Im gonna show n  charm secton Theves can beneft MASSIVELY  charm spells So dualng   Enchanter   Thef s amazng plus ll get access    Enchantmentspecalzatonbenefttng tems lke  aforementoned Eyes   Beholder   get Use Any Item In fact I  use  EnchantergtThef n    vdeos Im showng yre  er  MageThef   Necromancer  thngs  work  even better f I used  dual

EnchantergtTheves can use spells   Evocaton school va scrolls   get Use Any Item They can also learn sad spells  cast m freely f  use  eplot far IMO cause f  can use  scroll wth UAI n   scrbe t

 Get Use Any Item  course

 Get  Book  Infnte Spells put t n r quck tem bar  swtch t   second mode turn  page

 Pause  game  use  book

 Swtch  book wth  scroll   spell  want  learn

 Unpause  vola  just learned  Evocaton spell   Enchanter  can    wth   prohbted school You may cast t lke normal

The Nymph Cloak s  nsanely powerful tem  lets  charm even Rakshasa cause  charm s treated   levelspell rolls  save vs breath  lasts forhours meanng  can charm someone rest n charm anor creature Oh  t also doesnt turn creatures hostle   charm wears  Yes ts amazng  t doesnt smply substtute actual spellcastng  charm spells Frst  ts oneuseonly durng combat  re  gonna charm one creature  res good reason  charm  whole bunch  Ill show Second  t rolls  save vs breath t can also  worse aganst creatures wth good save vs breath   bad save vs spells So  mght wanna pck  choose whch  use  Nymph Cloak  charm spells vs dfferent creatures based  r saves

The Rng  Human Influence s smlarly amazng n  ts charm effect also lasts  unusually long tmerounds akaseconds  also doesnt turn creatures hostle   effect wears  Its orwse lke Charm Person n  t   save bonus   save vs spells whch Enchanters can mnmze   works  humanszed  smaller humanods Plus ts treated   levelspell Btw Safana bascally gets ths  effect   ablty n BGEE  ts touchrange   hostle charm nstead

The Staff  Command mamumcharges just sellbuy  recharge t   charm effect  charms forhours wthout  save Its  course absurdly OP So much   even I  cheese lover rarely use t cause t feels lke way  much   let  stop  Its consdered  levelspell  t cant charm Rakshasa  ts blocked  magc resstance though Plus ts  hostle charm  creatures wll turn red Afterfreakng hours The sky  r pockets   able  afford  recharges s  lmt beyond 



WHAT YOU CAN DO WITH CHARM EFFECTS FROM SPELLS AND ITEMS ALIKE

Frst lets remember  I sad   Nymph Cloak   Rng  Human Influence yre   game behndscenes calls neutral charms creatures  turn hostle   effect wears  The rest  spells   tems s whats called hostle charms

There  separate uses   knds  charm actually The  obvous one s  neutral charms ablty  smply get help   neutral creature thats around  anythng  want wthout  chance  angerng m

For eample  can get Garrck n Beregost  help  fght Slke wthout actually jonng  party   can get Slke  cast Improved Invsblty    help  fght  Red Wzards threatenng Neera btw n BGEE  n BGEE f     make  neutral Bard sng yll contnue    even   charms wears    effects wll reman Now I always getLuck anywhere n Beregost lol

Or maybe d lke   The Great Gazb  Bentha  vctm  help  defeat Zordral

You can also use Brennan Rslng  pckpocket  Rng  Regeneraton    hell f re   Mage rself let hm pckpocket  scroll  Lmted Wsh   Poton  Insght    hell use   wsh   Full Platethat  can loot  hs corpse I always  ths   start   game   Fghter lol

As  mghtve notced yes res  way  brng charmed creatures    areas  arent hardtranstons  requre   gar r party lke areas  enemes can follow   Its pretty smple order m  melee attack     enter  house  somethng yll follow

That transton trck also works wth summons   need  charm m surprsngly cause  r summons transton  lose control  m  reman alled     cant select m anymore unless yre charmed You can also   transton  THEN charm  ts harder ths way IMO Just avod usng hostle charms cause  know Theyll turn hostle later

Now heres somethng  can easly  wth hostle charms get away wth murder If  order  charmed creature   somethng yll generally dependnd   scrpt f  spot  etc contnue    acton even f  charm wears    perform t That means    easy way  get  bluecrcle creature  murder anor   wthout penaltes watch  res  reputaton penalty   guard klls  res one  I  t Plus snce  charm lasts  short tme ths trck s easer  perform  wth  charm  need  wayhours  wear      dspel

You can also use charm   able  talk  people   turned hostle Ths s especally great n Icewnd Dale btw   can murder  Clerc n  temple  hs amazng gear angerng  entrety  Easthaven n  process  n charm  man quest dude   able  contnue  story leavng Easthaven

Theres also  way  use charm spells  fully turn  hostle creature nto  neutral one  ts  messy  eplan  just check   gude     t   wk f re curous

Remember  I sad charm effects  amazng  Theves Well lets get  t  can pckpocket  charmed enemy even r weapon n certan cases lke Ill show   can place traps  hdenshadows  re  around charmedfrendly creatures That means   thngs Theves    outsde  combat wher  t  runnng away durng t  can  durng combat va charm

Heres  charmng Karlat swtchng hs weapon  hs fst  can  swtch weapons  creatures wth tradtonal classes lke Fghter  Mage  get   UI    select multple creatures f     class lke   n pckpocketng hs ae  needponts n pckpocket  steal weapons Look now  can   nonlethal damage   lterally  kll    Famlar The wk   table  shows  mnmum amount  ponts  need  pckpocket  knd  tem btw lkefor weapons andfor rngs

In fact  often  need  pckpocket weapons n BGEE  SoA  just swtchng enemes   fsts wll make m keep usng m So dsarmng s  just  MageThefeclusve thng  t loses effectveness n ToB  gotta pckpocket  weapons re f  can

You can even pckpocket potons  charmed Fre Gants   wont use m   can swtch m   r weapons   Throne  Bhaal enemes   scrpt  makes m shout   help  frends  also makes m equp ranged weapons f avalable   swtch  melee ones f  So  cant make m attack eternally wth r fsts yll eventually swtch back  r unstealable hammer   can force m  attack wth fsts  delay  shout  help   good whle  orderng m  attack  wth r fst also dk f ts clear   vdeo   can pckpocket  large enemes  choosng  pckpocket wth r Thef n movng  large enemy around

But lets see  lot  t comng toger charm traps backstabbng   charm wth  MageThef  even  EnchantergtThef  notce  I put zero ponts nto HdeMove Slently     nto Set Trap   m  n pckpocket  defeat  bunch  hobgoblns early n BGEE wthout takng  damage n style

Whats   can use charm  completely waste  spells  ClercDrudsMages You can even cancel    castng  speed thngs   avod actual effects  I steal  weapon  well  f wastng   spells wasnt enough lol

Dont  anybody useful  charm around  Then rest  get er guards bandts  monsters  come  

Theres lterally  unlmted amount  strateges  can  wth charm spells dependng  whats around  Hell  can even charm Kng Iltocal  help  kll hs  sahuagn servants hes pretty beefyattacks per round Just eperment You  two sources  neutral charm  use  creatures   want  kll    plenty  hostle charms  everybody else","baldursgate",5,"https://www.reddit.com/r/baldursgate/comments/11ntsae/lets_have_fun_with_arcane_spells_2_enchantment/"
